[
  {
    "customer_id": "C00000001",
    "campaign_id": "CMP2024_QR01",
    "natural_transaction_propensity": 0.9066,
    "qr_affinity": 0.2534,
    "price_sensitivity": 0.2522,
    "campaign_sensitivity": 0.1908,
    "digital_maturity": 0.7539,
    "offer_fatigue": 0.0203,
    "p_y_control": 0.796394,
    "p_y_treat": 0.89381,
    "true_uplift": 0.097416
  },
  {
    "customer_id": "C00000002",
    "campaign_id": "CMP2024_QR01",
    "natural_transaction_propensity": 0.502,
    "qr_affinity": 0.2333,
    "price_sensitivity": 0.3168,
    "campaign_sensitivity": 0.1946,
    "digital_maturity": 0.671,
    "offer_fatigue": 0.7028,
    "p_y_control": 0.657726,
    "p_y_treat": 0.065928,
    "true_uplift": -0.591798
  },
  {
    "customer_id": "C00000003",
    "campaign_id": "CMP2024_QR01",
    "natural_transaction_propensity": 0.5222,
    "qr_affinity": 0.644,
    "price_sensitivity": 0.5854,
    "campaign_sensitivity": 0.6674,
    "digital_maturity": 0.7005,
    "offer_fatigue": 0.014,
    "p_y_control": 0.667946,
    "p_y_treat": 0.952658,
    "true_uplift": 0.284712
  },
  {
    "customer_id": "C00000004",
    "campaign_id": "CMP2024_QR01",
    "natural_transaction_propensity": 0.7808,
    "qr_affinity": 0.2371,
    "price_sensitivity": 0.2847,
    "campaign_sensitivity": 0.0885,
    "digital_maturity": 0.9176,
    "offer_fatigue": 0.1006,
    "p_y_control": 0.818772,
    "p_y_treat": 0.87672,
    "true_uplift": 0.057948
  },
  {
    "customer_id": "C00000005",
    "campaign_id": "CMP2024_QR01",
    "natural_transaction_propensity": 0.7222,
    "qr_affinity": 0.5885,
    "price_sensitivity": 0.193,
    "campaign_sensitivity": 0.2436,
    "digital_maturity": 0.6261,
    "offer_fatigue": 0.0881,
    "p_y_control": 0.687035,
    "p_y_treat": 0.870548,
    "true_uplift": 0.183513
  },
  {
    "customer_id": "C00000006",
    "campaign_id": "CMP2024_QR01",
    "natural_transaction_propensity": 0.9227,
    "qr_affinity": 0.4911,
    "price_sensitivity": 0.2389,
    "campaign_sensitivity": 0.2122,
    "digital_maturity": 0.5008,
    "offer_fatigue": 0.0269,
    "p_y_control": 0.812911,
    "p_y_treat": 0.92694,
    "true_uplift": 0.114029
  },
  {
    "customer_id": "C00000007",
    "campaign_id": "CMP2024_QR01",
    "natural_transaction_propensity": 0.8465,
    "qr_affinity": 0.4556,
    "price_sensitivity": 0.1888,
    "campaign_sensitivity": 0.1749,
    "digital_maturity": 0.4588,
    "offer_fatigue": 0.869,
    "p_y_control": 0.756878,
    "p_y_treat": 0.092798,
    "true_uplift": -0.66408
  },
  {
    "customer_id": "C00000008",
    "campaign_id": "CMP2024_QR01",
    "natural_transaction_propensity": 0.626,
    "qr_affinity": 0.457,
    "price_sensitivity": 0.3393,
    "campaign_sensitivity": 0.0934,
    "digital_maturity": 0.6034,
    "offer_fatigue": 0.9242,
    "p_y_control": 0.630503,
    "p_y_treat": 0.046343,
    "true_uplift": -0.58416
  },
  {
    "customer_id": "C00000009",
    "campaign_id": "CMP2024_QR01",
    "natural_transaction_propensity": 0.3882,
    "qr_affinity": 0.4794,
    "price_sensitivity": 0.7471,
    "campaign_sensitivity": 0.9104,
    "digital_maturity": 0.6468,
    "offer_fatigue": 0.2175,
    "p_y_control": 0.40052,
    "p_y_treat": 0.871127,
    "true_uplift": 0.470607
  },
  {
    "customer_id": "C00000010",
    "campaign_id": "CMP2024_QR01",
    "natural_transaction_propensity": 0.454,
    "qr_affinity": 0.2618,
    "price_sensitivity": 0.7785,
    "campaign_sensitivity": 0.7353,
    "digital_maturity": 0.685,
    "offer_fatigue": 0.1444,
    "p_y_control": 0.721029,
    "p_y_treat": 0.943924,
    "true_uplift": 0.222895
  },
  {
    "customer_id": "C00000011",
    "campaign_id": "CMP2024_QR01",
    "natural_transaction_propensity": 0.7664,
    "qr_affinity": 0.808,
    "price_sensitivity": 0.2072,
    "campaign_sensitivity": 0.1199,
    "digital_maturity": 0.7177,
    "offer_fatigue": 0.073,
    "p_y_control": 0.720515,
    "p_y_treat": 0.894727,
    "true_uplift": 0.174212
  },
  {
    "customer_id": "C00000012",
    "campaign_id": "CMP2024_QR01",
    "natural_transaction_propensity": 0.7493,
    "qr_affinity": 0.5643,
    "price_sensitivity": 0.3598,
    "campaign_sensitivity": 0.0749,
    "digital_maturity": 0.6733,
    "offer_fatigue": 0.9017,
    "p_y_control": 0.720021,
    "p_y_treat": 0.077967,
    "true_uplift": -0.642054
  },
  {
    "customer_id": "C00000013",
    "campaign_id": "CMP2024_QR01",
    "natural_transaction_propensity": 0.4447,
    "qr_affinity": 0.1718,
    "price_sensitivity": 0.8407,
    "campaign_sensitivity": 0.8505,
    "digital_maturity": 0.3065,
    "offer_fatigue": 0.1051,
    "p_y_control": 0.544397,
    "p_y_treat": 0.904769,
    "true_uplift": 0.360372
  },
  {
    "customer_id": "C00000014",
    "campaign_id": "CMP2024_QR01",
    "natural_transaction_propensity": 0.1347,
    "qr_affinity": 0.2694,
    "price_sensitivity": 0.1017,
    "campaign_sensitivity": 0.0939,
    "digital_maturity": 0.197,
    "offer_fatigue": 0.5693,
    "p_y_control": 0.368654,
    "p_y_treat": 0.289965,
    "true_uplift": -0.078689
  },
  {
    "customer_id": "C00000015",
    "campaign_id": "CMP2024_QR01",
    "natural_transaction_propensity": 0.2069,
    "qr_affinity": 0.1038,
    "price_sensitivity": 0.2463,
    "campaign_sensitivity": 0.1036,
    "digital_maturity": 0.3869,
    "offer_fatigue": 0.6315,
    "p_y_control": 0.454328,
    "p_y_treat": 0.060952,
    "true_uplift": -0.393376
  },
  {
    "customer_id": "C00000016",
    "campaign_id": "CMP2024_QR01",
    "natural_transaction_propensity": 0.1323,
    "qr_affinity": 0.1604,
    "price_sensitivity": 0.296,
    "campaign_sensitivity": 0.0542,
    "digital_maturity": 0.4171,
    "offer_fatigue": 0.381,
    "p_y_control": 0.510348,
    "p_y_treat": 0.474881,
    "true_uplift": -0.035467
  },
  {
    "customer_id": "C00000017",
    "campaign_id": "CMP2024_QR01",
    "natural_transaction_propensity": 0.0851,
    "qr_affinity": 0.2971,
    "price_sensitivity": 0.176,
    "campaign_sensitivity": 0.2764,
    "digital_maturity": 0.3375,
    "offer_fatigue": 0.345,
    "p_y_control": 0.369069,
    "p_y_treat": 0.467901,
    "true_uplift": 0.098832
  },
  {
    "customer_id": "C00000018",
    "campaign_id": "CMP2024_QR01",
    "natural_transaction_propensity": 0.3561,
    "qr_affinity": 0.7211,
    "price_sensitivity": 0.7038,
    "campaign_sensitivity": 0.8576,
    "digital_maturity": 0.5745,
    "offer_fatigue": 0.0988,
    "p_y_control": 0.592564,
    "p_y_treat": 0.954686,
    "true_uplift": 0.362122
  },
  {
    "customer_id": "C00000019",
    "campaign_id": "CMP2024_QR01",
    "natural_transaction_propensity": 0.1306,
    "qr_affinity": 0.3577,
    "price_sensitivity": 0.1812,
    "campaign_sensitivity": 0.1516,
    "digital_maturity": 0.4463,
    "offer_fatigue": 0.1279,
    "p_y_control": 0.353363,
    "p_y_treat": 0.500478,
    "true_uplift": 0.147115
  },
  {
    "customer_id": "C00000020",
    "campaign_id": "CMP2024_QR01",
    "natural_transaction_propensity": 0.5464,
    "qr_affinity": 0.315,
    "price_sensitivity": 0.8284,
    "campaign_sensitivity": 0.8298,
    "digital_maturity": 0.4517,
    "offer_fatigue": 0.0224,
    "p_y_control": 0.592066,
    "p_y_treat": 0.937342,
    "true_uplift": 0.345276
  },
  {
    "customer_id": "C00000021",
    "campaign_id": "CMP2024_QR01",
    "natural_transaction_propensity": 0.6754,
    "qr_affinity": 0.7155,
    "price_sensitivity": 0.3918,
    "campaign_sensitivity": 0.1106,
    "digital_maturity": 0.7185,
    "offer_fatigue": 0.893,
    "p_y_control": 0.737468,
    "p_y_treat": 0.108787,
    "true_uplift": -0.628681
  },
  {
    "customer_id": "C00000022",
    "campaign_id": "CMP2024_QR01",
    "natural_transaction_propensity": 0.1118,
    "qr_affinity": 0.3751,
    "price_sensitivity": 0.1295,
    "campaign_sensitivity": 0.0655,
    "digital_maturity": 0.1006,
    "offer_fatigue": 0.2668,
    "p_y_control": 0.332571,
    "p_y_treat": 0.382786,
    "true_uplift": 0.050215
  },
  {
    "customer_id": "C00000023",
    "campaign_id": "CMP2024_QR01",
    "natural_transaction_propensity": 0.4875,
    "qr_affinity": 0.2791,
    "price_sensitivity": 0.5087,
    "campaign_sensitivity": 0.6561,
    "digital_maturity": 0.3064,
    "offer_fatigue": 0.1828,
    "p_y_control": 0.576361,
    "p_y_treat": 0.862533,
    "true_uplift": 0.286172
  },
  {
    "customer_id": "C00000024",
    "campaign_id": "CMP2024_QR01",
    "natural_transaction_propensity": 0.7544,
    "qr_affinity": 0.1926,
    "price_sensitivity": 0.3692,
    "campaign_sensitivity": 0.1098,
    "digital_maturity": 0.7122,
    "offer_fatigue": 0.6811,
    "p_y_control": 0.80803,
    "p_y_treat": 0.11897,
    "true_uplift": -0.68906
  },
  {
    "customer_id": "C00000025",
    "campaign_id": "CMP2024_QR01",
    "natural_transaction_propensity": 0.17,
    "qr_affinity": 0.0592,
    "price_sensitivity": 0.1374,
    "campaign_sensitivity": 0.2464,
    "digital_maturity": 0.3514,
    "offer_fatigue": 0.1194,
    "p_y_control": 0.368951,
    "p_y_treat": 0.467356,
    "true_uplift": 0.098405
  },
  {
    "customer_id": "C00000026",
    "campaign_id": "CMP2024_QR01",
    "natural_transaction_propensity": 0.5086,
    "qr_affinity": 0.5275,
    "price_sensitivity": 0.6601,
    "campaign_sensitivity": 0.7169,
    "digital_maturity": 0.3804,
    "offer_fatigue": 0.3172,
    "p_y_control": 0.665032,
    "p_y_treat": 0.923985,
    "true_uplift": 0.258953
  },
  {
    "customer_id": "C00000027",
    "campaign_id": "CMP2024_QR01",
    "natural_transaction_propensity": 0.5413,
    "qr_affinity": 0.3073,
    "price_sensitivity": 0.5339,
    "campaign_sensitivity": 0.7794,
    "digital_maturity": 0.5425,
    "offer_fatigue": 0.2539,
    "p_y_control": 0.621126,
    "p_y_treat": 0.898449,
    "true_uplift": 0.277323
  },
  {
    "customer_id": "C00000028",
    "campaign_id": "CMP2024_QR01",
    "natural_transaction_propensity": 0.8066,
    "qr_affinity": 0.559,
    "price_sensitivity": 0.1686,
    "campaign_sensitivity": 0.235,